{
  "schema": "app-manifest.v1",
  "appId": "sample",
  "version": "1.0.0",
  "name": {
    "en": "Sample",
    "de": "Beispiel"
  },
  "description": {
    "en": "Sample application",
    "de": "Beispielanwendung"
  },
  "architectures": [
    "linux/amd64"
  ],
  "deliveryOptions": [
    {
      "key": "compose",
      "kind": "docker-compose",
      "composePath": "compose.yaml",
      "composeSha256": "8b40919a851783616e21a736021c02695ab051f398dc19ba63cf8e6a13c5d71f"
    }
  ]
}
