{
  "schema": "app-manifest.v1",
  "appId": "sample",
  "version": "1.0.0",
  "name": {
    "en": "Sample",
    "de": "Beispiel"
  },
  "description": {
    "en": "Sample application",
    "de": "Beispielanwendung"
  },
  "architectures": [
    "linux/amd64"
  ],
  "deliveryOptions": [
    {
      "key": "connect",
      "kind": "connection",
      "connectionKind": "sample-api",
      "endpointPolicy": "https-only"
    },
    {
      "key": "image",
      "kind": "docker-image",
      "image": "example/app:1.0.0"
    },
    {
      "key": "compose",
      "kind": "docker-compose",
      "composePath": "compose.yaml",
      "composeSha256": "98d1d222a186bf4345c489a81890112a6b6e36be875101862d41788c31df0d93"
    }
  ],
  "requiredFeatures": [
    "docker.compose"
  ]
}
